2025-12-14 21:15:02 | INFO     | setup_logging        | Logging initialized. Log file: /Users/jonc/code/prune-github-repo-for-ai-context-engineering/logs/log_20251214_211502.txt
2025-12-14 21:15:02 | INFO     | main                 | Loading configuration from: /Users/jonc/code/prune-github-repo-for-ai-context-engineering/config.yaml
2025-12-14 21:15:02 | INFO     | main                 | Configuration loaded successfully (AI Coding Env: chat)
2025-12-14 21:15:02 | INFO     | distill              | Starting distillation...
2025-12-14 21:15:02 | INFO     | distill              | Source: /Users/jonc/code/iphs391-mp2-ai-emotional-theory-of-minds
2025-12-14 21:15:02 | INFO     | distill              | Destination: /Users/jonc/code/iphs391-mp2-ai-emotional-theory-of-minds-distilled
2025-12-14 21:15:02 | INFO     | distill              | Configuration: AI Coding Env = chat
2025-12-14 21:15:04 | INFO     | _sample_json_file    | SAMPLED[JSON]: proj28export.json (60 items)
2025-12-14 21:15:04 | INFO     | _sample_json_file    | SAMPLED[JSON - copied intact]: gpt-5-mini_20251124_004757.json (9 items)
2025-12-14 21:15:04 | INFO     | _sample_json_file    | SAMPLED[JSON - copied intact]: gpt-5-mini_20251124_002424.json (5 items)
2025-12-14 21:15:04 | INFO     | _sample_json_file    | SAMPLED[JSON - copied intact]: gpt-5-mini_20251124_012814.json (9 items)
2025-12-14 21:15:04 | INFO     | _sample_csv_file     | SAMPLED[CSV]: per_annotator.csv (16 rows)
2025-12-14 21:15:04 | INFO     | _sample_csv_file     | SAMPLED[CSV]: metrics.csv (2 rows)
2025-12-14 21:15:04 | INFO     | _sample_csv_file     | SAMPLED[CSV]: triage.csv (51 rows)
2025-12-14 21:15:04 | INFO     | _sample_csv_file     | SAMPLED[CSV]: per_item.csv (301 rows)
2025-12-14 21:15:04 | INFO     | _sample_csv_file     | SAMPLED[CSV]: per_batch.csv (17 rows)
2025-12-14 21:15:04 | INFO     | _sample_csv_file     | SAMPLED[CSV]: triage_with_sources.csv (361 rows)
2025-12-14 21:15:04 | INFO     | _sample_csv_file     | SAMPLED[CSV]: adjudication_audit_log.csv (12 rows)
2025-12-14 21:15:04 | INFO     | _sample_csv_file     | SAMPLED[CSV]: per_annotator.csv (16 rows)
2025-12-14 21:15:04 | INFO     | _sample_csv_file     | SAMPLED[CSV]: metrics.csv (2 rows)
2025-12-14 21:15:04 | INFO     | _sample_csv_file     | SAMPLED[CSV]: triage.csv (121 rows)
2025-12-14 21:15:04 | INFO     | _sample_csv_file     | SAMPLED[CSV]: per_item.csv (301 rows)
2025-12-14 21:15:04 | INFO     | _sample_csv_file     | SAMPLED[CSV]: per_batch.csv (16 rows)
2025-12-14 21:15:04 | INFO     | _sample_csv_file     | SAMPLED[CSV]: per_annotator.csv (16 rows)
2025-12-14 21:15:04 | INFO     | _sample_csv_file     | SAMPLED[CSV]: metrics.csv (2 rows)
2025-12-14 21:15:04 | INFO     | _sample_csv_file     | SAMPLED[CSV]: triage.csv (51 rows)
2025-12-14 21:15:04 | INFO     | _sample_csv_file     | SAMPLED[CSV]: per_item.csv (301 rows)
2025-12-14 21:15:04 | INFO     | _sample_csv_file     | SAMPLED[CSV]: per_batch.csv (17 rows)
2025-12-14 21:15:04 | INFO     | _sample_csv_file     | SAMPLED[CSV]: triage_with_sources.csv (7 rows)
2025-12-14 21:15:04 | INFO     | _sample_csv_file     | SAMPLED[CSV]: per_annotator.csv (4 rows)
2025-12-14 21:15:04 | INFO     | _sample_csv_file     | SAMPLED[CSV]: metrics.csv (2 rows)
2025-12-14 21:15:04 | INFO     | _sample_csv_file     | SAMPLED[CSV]: triage.csv (3 rows)
2025-12-14 21:15:04 | INFO     | _sample_csv_file     | SAMPLED[CSV]: per_item.csv (3 rows)
2025-12-14 21:15:04 | INFO     | _sample_csv_file     | SAMPLED[CSV]: per_batch.csv (4 rows)
2025-12-14 21:15:04 | INFO     | _sample_csv_file     | SAMPLED[CSV]: examples_mixed_signals-GOLD-AI_unlabeled_20251203-jonc.csv (61 rows)
2025-12-14 21:15:04 | INFO     | _sample_csv_file     | SAMPLED[CSV]: examples_sarcasm_irony-GOLD-AI_unlabeled copy.csv (61 rows)
2025-12-14 21:15:04 | INFO     | _sample_csv_file     | SAMPLED[CSV]: table_annotators-id.csv (16 rows)
2025-12-14 21:15:04 | INFO     | _sample_json_file    | SAMPLED[JSONL]: examples_strategic_politeness-GOLD-AI_unlabeled.jsonl (60 objects)
2025-12-14 21:15:04 | INFO     | _sample_json_file    | SAMPLED[JSONL]: examples_passive_aggression-GOLD-AI_unlabeled.jsonl (60 objects)
2025-12-14 21:15:04 | INFO     | _sample_json_file    | SAMPLED[JSON]: examples_passive_aggression.json (270 items)
2025-12-14 21:15:04 | INFO     | _sample_csv_file     | SAMPLED[CSV]: examples_passive_aggression-GOLD-AI_unlabeled_20251203-jonc.csv (61 rows)
2025-12-14 21:15:04 | INFO     | _sample_csv_file     | SAMPLED[CSV]: examples_passive_aggression-GOLD-AI_unlabeled_20251205-hannah.csv (61 rows)
2025-12-14 21:15:04 | INFO     | _sample_json_file    | SAMPLED[JSON]: examples_sarcasm_irony.json (270 items)
2025-12-14 21:15:04 | INFO     | _sample_json_file    | SAMPLED[JSONL]: examples_sarcasm_irony-GOLD-AI_unlabeled.jsonl (60 objects)
2025-12-14 21:15:04 | INFO     | _sample_csv_file     | SAMPLED[CSV]: examples_strategic_politeness-GOLD-AI_unlabeled_20251206-err-labels.csv (61 rows)
2025-12-14 21:15:04 | INFO     | _sample_csv_file     | SAMPLED[CSV]: examples_deflection_misdirection-GOLD-AI_unlabeled_utf8-error_20251205.csv (61 rows)
2025-12-14 21:15:04 | INFO     | _sample_json_file    | SAMPLED[JSONL]: examples_deflection_misdirection-GOLD-AI_unlabeled.jsonl (60 objects)
2025-12-14 21:15:04 | INFO     | _sample_json_file    | SAMPLED[JSON]: examples_mixed_signals.json (270 items)
2025-12-14 21:15:04 | INFO     | _sample_csv_file     | SAMPLED[CSV]: examples_deflection_misdirection-GOLD-AI_unlabeled.csv (61 rows)
2025-12-14 21:15:04 | INFO     | _sample_csv_file     | SAMPLED[CSV]: examples_sarcasm_irony-GOLD-AI_unlabeled-utf8-error.csv (61 rows)
2025-12-14 21:15:04 | INFO     | _sample_csv_file     | SAMPLED[CSV]: examples_sarcasm_irony-GOLD-AI_unlabeled_20251204-1614 copy.csv (61 rows)
2025-12-14 21:15:04 | INFO     | _sample_csv_file     | SAMPLED[CSV]: examples_deflection_misdirection-GOLD-AI_unlabeled copy.csv (61 rows)
2025-12-14 21:15:04 | INFO     | _sample_csv_file     | SAMPLED[CSV]: examples_mixed_signals-GOLD-AI_unlabeled.csv (61 rows)
2025-12-14 21:15:04 | INFO     | _sample_csv_file     | SAMPLED[CSV]: examples_passive_aggression-GOLD-AI_unlabeled_20251206-err-labels.csv (61 rows)
2025-12-14 21:15:04 | INFO     | _sample_json_file    | SAMPLED[JSON]: examples_deflection_misdirection.json (270 items)
2025-12-14 21:15:04 | INFO     | _sample_csv_file     | SAMPLED[CSV]: examples_strategic_politeness-GOLD-AI_unlabeled copy.csv (61 rows)
2025-12-14 21:15:04 | INFO     | _sample_csv_file     | SAMPLED[CSV]: examples_sarcasm_irony-GOLD-AI_unlabeled_utf8-fix_20251205-jonc.csv (61 rows)
2025-12-14 21:15:04 | INFO     | _sample_csv_file     | SAMPLED[CSV]: examples_mixed_signals-GOLD-AI_unlabeled_20251206-err-labels.csv (61 rows)
2025-12-14 21:15:04 | INFO     | _sample_csv_file     | SAMPLED[CSV]: examples_sarcasm_irony-GOLD-AI_unlabeled-20251205-hannah.csv (61 rows)
2025-12-14 21:15:04 | INFO     | _sample_csv_file     | SAMPLED[CSV]: examples_mixed_signals-GOLD-AI_unlabeled_20251205-hannah.csv (61 rows)
2025-12-14 21:15:04 | INFO     | _sample_csv_file     | SAMPLED[CSV]: examples_sarcasm_irony-GOLD-AI_unlabeled.csv (61 rows)
2025-12-14 21:15:04 | INFO     | _sample_json_file    | SAMPLED[JSONL]: examples_mixed_signals-GOLD-AI_unlabeled.jsonl (60 objects)
2025-12-14 21:15:04 | INFO     | _sample_csv_file     | SAMPLED[CSV]: examples_strategic_politeness-GOLD-AI_unlabeled_20251204-jonc.csv (61 rows)
2025-12-14 21:15:04 | INFO     | _sample_csv_file     | SAMPLED[CSV]: examples_deflection_misdirection-GOLD-AI_unlabeled_20251206-err-labels.csv (61 rows)
2025-12-14 21:15:04 | INFO     | _sample_csv_file     | SAMPLED[CSV]: examples_deflection_misdirection-GOLD-AI_unlabeled_utf8-fix_20251205-jonc.csv (61 rows)
2025-12-14 21:15:04 | INFO     | _sample_csv_file     | SAMPLED[CSV]: examples_passive_aggression-GOLD-AI_unlabeled.csv (61 rows)
2025-12-14 21:15:04 | INFO     | _sample_json_file    | SAMPLED[JSON]: examples_strategic_politeness.json (270 items)
2025-12-14 21:15:04 | INFO     | _sample_csv_file     | SAMPLED[CSV]: examples_sarcasm_irony-GOLD-AI_unlabeled_20251206-err-labels.csv (61 rows)
2025-12-14 21:15:04 | INFO     | _sample_csv_file     | SAMPLED[CSV]: examples_passive_aggression-GOLD-AI_unlabeled copy.csv (61 rows)
2025-12-14 21:15:04 | INFO     | _sample_csv_file     | SAMPLED[CSV]: examples_mixed_signals-GOLD-AI_unlabeled copy.csv (61 rows)
2025-12-14 21:15:04 | INFO     | _sample_csv_file     | SAMPLED[CSV]: examples_strategic_politeness-GOLD-AI_unlabeled.csv (61 rows)
2025-12-14 21:15:04 | INFO     | _sample_csv_file     | SAMPLED[CSV]: examples_sarcasm_irony-GOLD-AI_unlabeled copy 2.csv (61 rows)
2025-12-14 21:15:04 | INFO     | _sample_csv_file     | SAMPLED[CSV]: examples_deflection_misdirection-GOLD-AI_unlabeled-20251205-hanna.csv (61 rows)
2025-12-14 21:15:04 | INFO     | _sample_csv_file     | SAMPLED[CSV]: examples_sarcasm_irony-GOLD-AI_unlabeled_20251204-1614.csv (61 rows)
2025-12-14 21:15:04 | INFO     | _sample_json_file    | SAMPLED[JSON]: examples_sarcasm_irony_min.json (270 items)
2025-12-14 21:15:04 | INFO     | _sample_json_file    | SAMPLED[JSON - copied intact]: examples_passive_aggression.json (6 items)
2025-12-14 21:15:04 | INFO     | _sample_json_file    | SAMPLED[JSON - copied intact]: examples_sarcasm_irony.json (6 items)
2025-12-14 21:15:04 | INFO     | _sample_json_file    | SAMPLED[JSON - copied intact]: examples_mixed_signals.json (6 items)
2025-12-14 21:15:04 | INFO     | _sample_json_file    | SAMPLED[JSON - copied intact]: examples_deflection_misdirection.json (6 items)
2025-12-14 21:15:04 | INFO     | _sample_json_file    | SAMPLED[JSON - copied intact]: examples_strategic_politeness.json (6 items)
2025-12-14 21:15:04 | INFO     | _sample_json_file    | SAMPLED[JSON - copied intact]: examples_passive_aggression.json (4 items)
2025-12-14 21:15:04 | INFO     | _sample_json_file    | SAMPLED[JSON - copied intact]: examples_sarcasm_irony.json (4 items)
2025-12-14 21:15:04 | INFO     | _sample_json_file    | SAMPLED[JSON - copied intact]: examples_mixed_signals.json (4 items)
2025-12-14 21:15:04 | INFO     | _sample_json_file    | SAMPLED[JSON - copied intact]: examples_deflection_misdirection.json (4 items)
2025-12-14 21:15:04 | INFO     | _sample_json_file    | SAMPLED[JSON - copied intact]: examples_strategic_politeness.json (4 items)
2025-12-14 21:15:04 | INFO     | _sample_json_file    | SAMPLED[JSON - copied intact]: examples_sarcasm_irony.json (6 items)
2025-12-14 21:15:04 | INFO     | _sample_json_file    | SAMPLED[JSON - copied intact]: examples_mixed_signals.json (6 items)
2025-12-14 21:15:04 | INFO     | _sample_json_file    | SAMPLED[JSON]: project-28_adrian-passive-aggression_-at-2025-12-07-21-14-9d7f54cc.json (60 items)
2025-12-14 21:15:04 | INFO     | _sample_json_file    | SAMPLED[JSON]: project-24_gwen-sarcasm-irony_at-2025-12-08-04-19-de07973b.json (60 items)
2025-12-14 21:15:04 | INFO     | _sample_json_file    | SAMPLED[JSON]: project-14_tiffanie-deflection-misdirection_-at-2025-12-07-22-50-c8d43bb7.json (60 items)
2025-12-14 21:15:04 | INFO     | _sample_json_file    | SAMPLED[JSON]: project-22_hannah-sarcasm-irony_at-2025-12-08-04-22-3c746407.json (60 items)
2025-12-14 21:15:04 | INFO     | _sample_csv_file     | SAMPLED[CSV]: project-16_anna-mixed-signals_at-2025-12-08-04-24-2841df6f.csv (61 rows)
2025-12-14 21:15:04 | INFO     | _sample_json_file    | SAMPLED[JSON]: project-26_wisdom-strategic-politeness_-at-2025-12-07-13-35-7dd50846.json (60 items)
2025-12-14 21:15:04 | INFO     | _sample_json_file    | SAMPLED[JSON]: project-27_mous-strategic-politeness_at-2025-12-08-07-02-14829172.json (60 items)
2025-12-14 21:15:04 | INFO     | _sample_json_file    | SAMPLED[JSON]: project-25_morty-strategic-politeness-at-2025-12-08-01-18-4ed42e46.json (60 items)
2025-12-14 21:15:04 | INFO     | _sample_csv_file     | SAMPLED[CSV]: project-20_eli-passive-aggression_at-2025-12-08-01-16-d6ab1c16.csv (61 rows)
2025-12-14 21:15:04 | INFO     | _sample_csv_file     | SAMPLED[CSV]: project-21_godwin-passive-aggression_at-2025-12-07-13-35-9f9dfd99.csv (61 rows)
2025-12-14 21:15:04 | INFO     | _sample_json_file    | SAMPLED[JSON]: project-20_eli-passive-aggression_at-2025-12-08-01-16-d6ab1c16.json (60 items)
2025-12-14 21:15:04 | INFO     | _sample_json_file    | SAMPLED[JSON]: project-15_kirill-deflection-misdirection_at-2025-12-07-13-33-d7c44bd6.json (60 items)
2025-12-14 21:15:04 | INFO     | _sample_json_file    | SAMPLED[JSON]: project-13_anne-duncan-deflection-misdirection_-at-2025-12-07-21-15-b32f81aa.json (60 items)
2025-12-14 21:15:04 | INFO     | _sample_csv_file     | SAMPLED[CSV]: project-22_hannah-sarcasm-irony_at-2025-12-08-04-22-3c746407.csv (61 rows)
2025-12-14 21:15:04 | INFO     | _sample_csv_file     | SAMPLED[CSV]: project-17_peter-mixed-signals-at-2025-12-07-19-41-54b48278.csv (61 rows)
2025-12-14 21:15:04 | INFO     | _sample_json_file    | SAMPLED[JSON]: project-21_godwin-passive-aggression_at-2025-12-07-13-34-9f9dfd99.json (60 items)
2025-12-14 21:15:04 | INFO     | _sample_json_file    | SAMPLED[JSON]: project-18_abhigya-mixed-signals_at-2025-12-08-03-01-59e2979a.json (60 items)
2025-12-14 21:15:04 | INFO     | _sample_csv_file     | SAMPLED[CSV]: project-27_mous-strategic-politeness_at-2025-12-08-07-02-14829172.csv (61 rows)
2025-12-14 21:15:04 | INFO     | _sample_csv_file     | SAMPLED[CSV]: project-13_anne-duncan-deflection-misdirection_-at-2025-12-07-21-15-b32f81aa.csv (61 rows)
2025-12-14 21:15:04 | INFO     | _sample_csv_file     | SAMPLED[CSV]: project-23_andre-sarcasm-irony-at-2025-12-07-19-40-cc032f45.csv (61 rows)
2025-12-14 21:15:04 | INFO     | _sample_csv_file     | SAMPLED[CSV]: project-14_tiffanie-deflection-misdirection_-at-2025-12-07-22-50-c8d43bb7.csv (61 rows)
2025-12-14 21:15:04 | INFO     | _sample_csv_file     | SAMPLED[CSV]: project-18_abhigya-mixed-signals_at-2025-12-08-03-01-59e2979a.csv (61 rows)
2025-12-14 21:15:04 | INFO     | _sample_csv_file     | SAMPLED[CSV]: project-28_adrian-passive-aggression_-at-2025-12-07-21-14-9d7f54cc.csv (61 rows)
2025-12-14 21:15:04 | INFO     | _sample_json_file    | SAMPLED[JSON]: project-17-peter-mixed-signals_at-2025-12-07-19-41-54b48278.json (60 items)
2025-12-14 21:15:04 | INFO     | _sample_csv_file     | SAMPLED[CSV]: project-15_kirill-deflection-misdirection_-at-2025-12-07-13-34-d7c44bd6.csv (61 rows)
2025-12-14 21:15:04 | INFO     | _sample_csv_file     | SAMPLED[CSV]: project-26_wisdom-strategic-politeness_-at-2025-12-07-13-35-7dd50846.csv (61 rows)
2025-12-14 21:15:04 | INFO     | _sample_csv_file     | SAMPLED[CSV]: project-25_morty-strategic-politeness-at-2025-12-08-01-18-4ed42e46.csv (61 rows)
2025-12-14 21:15:04 | INFO     | _sample_csv_file     | SAMPLED[CSV]: project-24_gwen-sarcasm-irony_at-2025-12-08-04-19-de07973b.csv (61 rows)
2025-12-14 21:15:04 | INFO     | _sample_json_file    | SAMPLED[JSON]: project-23_andre-sarcasm-irony-at-2025-12-07-19-40-cc032f45.json (60 items)
2025-12-14 21:15:04 | INFO     | _sample_json_file    | SAMPLED[JSON]: project-16_anna-mixed-signals_at-2025-12-08-04-24-2841df6f.json (60 items)
2025-12-14 21:15:04 | INFO     | _sample_json_file    | SAMPLED[JSON]: project-28_adrian-passive-aggression_-at-2025-12-07-21-14-9d7f54cc.json (60 items)
2025-12-14 21:15:04 | INFO     | _sample_json_file    | SAMPLED[JSON]: project-24_gwen-sarcasm-irony_at-2025-12-08-04-19-de07973b.json (60 items)
2025-12-14 21:15:04 | INFO     | _sample_json_file    | SAMPLED[JSON]: project-14_tiffanie-deflection-misdirection_-at-2025-12-07-22-50-c8d43bb7.json (60 items)
2025-12-14 21:15:04 | INFO     | _sample_json_file    | SAMPLED[JSON]: project-22_hannah-sarcasm-irony_at-2025-12-08-04-22-3c746407.json (60 items)
2025-12-14 21:15:04 | INFO     | _sample_csv_file     | SAMPLED[CSV]: project-16_anna-mixed-signals_at-2025-12-08-04-24-2841df6f.csv (61 rows)
2025-12-14 21:15:04 | INFO     | _sample_json_file    | SAMPLED[JSON]: project-26_wisdom-strategic-politeness_-at-2025-12-07-13-35-7dd50846.json (60 items)
2025-12-14 21:15:04 | INFO     | _sample_json_file    | SAMPLED[JSON]: project-27_mous-strategic-politeness_at-2025-12-08-07-02-14829172.json (60 items)
2025-12-14 21:15:04 | INFO     | _sample_json_file    | SAMPLED[JSON]: project-25_morty-strategic-politeness-at-2025-12-08-01-18-4ed42e46.json (60 items)
2025-12-14 21:15:04 | INFO     | _sample_csv_file     | SAMPLED[CSV]: project-20_eli-passive-aggression_at-2025-12-08-01-16-d6ab1c16.csv (61 rows)
2025-12-14 21:15:04 | INFO     | _sample_csv_file     | SAMPLED[CSV]: project-21_godwin-passive-aggression_at-2025-12-07-13-35-9f9dfd99.csv (61 rows)
2025-12-14 21:15:04 | INFO     | _sample_json_file    | SAMPLED[JSON]: project-20_eli-passive-aggression_at-2025-12-08-01-16-d6ab1c16.json (60 items)
2025-12-14 21:15:04 | INFO     | _sample_json_file    | SAMPLED[JSON]: project-15_kirill-deflection-misdirection_at-2025-12-07-13-33-d7c44bd6.json (60 items)
2025-12-14 21:15:04 | INFO     | _sample_json_file    | SAMPLED[JSON]: project-13_anne-duncan-deflection-misdirection_-at-2025-12-07-21-15-b32f81aa.json (60 items)
2025-12-14 21:15:04 | INFO     | _sample_csv_file     | SAMPLED[CSV]: project-22_hannah-sarcasm-irony_at-2025-12-08-04-22-3c746407.csv (61 rows)
2025-12-14 21:15:04 | INFO     | _sample_csv_file     | SAMPLED[CSV]: project-17_peter-mixed-signals-at-2025-12-07-19-41-54b48278.csv (61 rows)
2025-12-14 21:15:04 | INFO     | _sample_json_file    | SAMPLED[JSON]: project-21_godwin-passive-aggression_at-2025-12-07-13-34-9f9dfd99.json (60 items)
2025-12-14 21:15:04 | INFO     | _sample_json_file    | SAMPLED[JSON]: project-18_abhigya-mixed-signals_at-2025-12-08-03-01-59e2979a.json (60 items)
2025-12-14 21:15:04 | INFO     | _sample_csv_file     | SAMPLED[CSV]: project-27_mous-strategic-politeness_at-2025-12-08-07-02-14829172.csv (61 rows)
2025-12-14 21:15:04 | INFO     | _sample_csv_file     | SAMPLED[CSV]: project-13_anne-duncan-deflection-misdirection_-at-2025-12-07-21-15-b32f81aa.csv (61 rows)
2025-12-14 21:15:04 | INFO     | _sample_csv_file     | SAMPLED[CSV]: project-23_andre-sarcasm-irony-at-2025-12-07-19-40-cc032f45.csv (61 rows)
2025-12-14 21:15:04 | INFO     | _sample_csv_file     | SAMPLED[CSV]: project-14_tiffanie-deflection-misdirection_-at-2025-12-07-22-50-c8d43bb7.csv (61 rows)
2025-12-14 21:15:04 | INFO     | _sample_csv_file     | SAMPLED[CSV]: project-18_abhigya-mixed-signals_at-2025-12-08-03-01-59e2979a.csv (61 rows)
2025-12-14 21:15:04 | INFO     | _sample_csv_file     | SAMPLED[CSV]: project-28_adrian-passive-aggression_-at-2025-12-07-21-14-9d7f54cc.csv (61 rows)
2025-12-14 21:15:04 | INFO     | _sample_json_file    | SAMPLED[JSON]: project-17-peter-mixed-signals_at-2025-12-07-19-41-54b48278.json (60 items)
2025-12-14 21:15:04 | INFO     | _sample_csv_file     | SAMPLED[CSV]: project-15_kirill-deflection-misdirection_-at-2025-12-07-13-34-d7c44bd6.csv (61 rows)
2025-12-14 21:15:04 | INFO     | _sample_csv_file     | SAMPLED[CSV]: project-26_wisdom-strategic-politeness_-at-2025-12-07-13-35-7dd50846.csv (61 rows)
2025-12-14 21:15:04 | INFO     | _sample_csv_file     | SAMPLED[CSV]: project-25_morty-strategic-politeness-at-2025-12-08-01-18-4ed42e46.csv (61 rows)
2025-12-14 21:15:04 | INFO     | _sample_csv_file     | SAMPLED[CSV]: project-24_gwen-sarcasm-irony_at-2025-12-08-04-19-de07973b.csv (61 rows)
2025-12-14 21:15:04 | INFO     | _sample_json_file    | SAMPLED[JSON]: project-23_andre-sarcasm-irony-at-2025-12-07-19-40-cc032f45.json (60 items)
2025-12-14 21:15:04 | INFO     | _sample_json_file    | SAMPLED[JSON]: project-16_anna-mixed-signals_at-2025-12-08-04-24-2841df6f.json (60 items)
2025-12-14 21:15:04 | INFO     | _sample_json_file    | SAMPLED[JSON - copied intact]: examples_passive_aggression.json (4 items)
2025-12-14 21:15:04 | INFO     | _sample_json_file    | SAMPLED[JSON - copied intact]: examples_sarcasm_irony.json (4 items)
2025-12-14 21:15:04 | INFO     | _sample_json_file    | SAMPLED[JSON - copied intact]: examples_mixed_signals.json (4 items)
2025-12-14 21:15:04 | INFO     | _sample_json_file    | SAMPLED[JSON - copied intact]: examples_deflection_misdirection.json (4 items)
2025-12-14 21:15:04 | INFO     | _sample_json_file    | SAMPLED[JSON - copied intact]: examples_strategic_politeness.json (4 items)
2025-12-14 21:15:04 | INFO     | _sample_json_file    | SAMPLED[JSON]: examples_passive_aggression.json (60 items)
2025-12-14 21:15:04 | INFO     | _sample_json_file    | SAMPLED[JSON]: examples_sarcasm_irony.json (69 items)
2025-12-14 21:15:04 | INFO     | _sample_json_file    | SAMPLED[JSON]: examples_mixed_signals.json (60 items)
2025-12-14 21:15:04 | INFO     | _sample_json_file    | SAMPLED[JSON]: examples_deflection_misdirection.json (60 items)
2025-12-14 21:15:04 | INFO     | _sample_json_file    | SAMPLED[JSON]: examples_strategic_politeness.json (60 items)
2025-12-14 21:15:04 | INFO     | _sample_json_file    | SAMPLED[JSON - copied intact]: project-29-at-2025-12-06-19-01-c9185e81.json (3 items)
2025-12-14 21:15:04 | INFO     | _sample_json_file    | SAMPLED[JSON]: project-20-at-2025-12-08-01-16-d6ab1c16.json (60 items)
2025-12-14 21:15:04 | INFO     | _sample_json_file    | SAMPLED[JSON - copied intact]: project-5-at-2025-11-30-04-52-62abf398.json (4 items)
2025-12-14 21:15:04 | INFO     | _sample_json_file    | SAMPLED[JSON]: project-14-at-2025-12-07-22-50-c8d43bb7.json (60 items)
2025-12-14 21:15:04 | INFO     | _sample_json_file    | SAMPLED[JSON]: project-28-at-2025-12-07-21-14-9d7f54cc.json (60 items)
2025-12-14 21:15:04 | INFO     | _sample_json_file    | SAMPLED[JSON]: project-16-at-2025-12-08-04-24-2841df6f.json (60 items)
2025-12-14 21:15:04 | INFO     | _sample_json_file    | SAMPLED[JSON]: project-15-at-2025-12-07-13-34-d7c44bd6.json (60 items)
2025-12-14 21:15:04 | INFO     | _sample_json_file    | SAMPLED[JSON]: project-15-at-2025-12-07-21-55-d7c44bd6.json (60 items)
2025-12-14 21:15:04 | INFO     | _sample_json_file    | SAMPLED[JSON]: project-15-at-2025-12-07-13-33-d7c44bd6.json (60 items)
2025-12-14 21:15:04 | INFO     | _sample_json_file    | SAMPLED[JSON]: project-26-at-2025-12-07-00-32-7dd50846.json (60 items)
2025-12-14 21:15:04 | INFO     | _sample_json_file    | SAMPLED[JSON]: project-25-at-2025-12-06-19-05-abc3c31f.json (60 items)
2025-12-14 21:15:04 | INFO     | _sample_json_file    | SAMPLED[JSON]: project-13-at-2025-12-07-21-15-b32f81aa.json (60 items)
2025-12-14 21:15:04 | INFO     | _sample_json_file    | SAMPLED[JSON]: project-26-at-2025-12-06-19-03-f4ae717b.json (60 items)
2025-12-14 21:15:04 | INFO     | _sample_json_file    | SAMPLED[JSON]: project-25-at-2025-12-08-00-18-4ed42e46.json (60 items)
2025-12-14 21:15:04 | INFO     | _sample_json_file    | SAMPLED[JSON - copied intact]: project-29-at-2025-12-06-19-30-e36099fe.json (5 items)
2025-12-14 21:15:04 | INFO     | _sample_json_file    | SAMPLED[JSON]: project-18-at-2025-12-08-03-01-59e2979a.json (60 items)
2025-12-14 21:15:04 | INFO     | _sample_json_file    | SAMPLED[JSON]: project-21-at-2025-12-07-13-34-9f9dfd99.json (60 items)
2025-12-14 21:15:04 | INFO     | _sample_json_file    | SAMPLED[JSON]: project-22-at-2025-12-08-04-22-3c746407.json (60 items)
2025-12-14 21:15:04 | INFO     | _sample_json_file    | SAMPLED[JSON]: project-14-at-2025-12-07-21-40-998754c4.json (60 items)
2025-12-14 21:15:04 | INFO     | _sample_json_file    | SAMPLED[JSON - copied intact]: project-5-at-2025-11-30-04-51-7f97e080.json (1 items)
2025-12-14 21:15:04 | INFO     | _sample_json_file    | SAMPLED[JSON]: project-25-at-2025-12-08-01-18-4ed42e46.json (60 items)
2025-12-14 21:15:04 | INFO     | _sample_json_file    | SAMPLED[JSON]: project-20-at-2025-12-08-04-12-d6ab1c16.json (60 items)
2025-12-14 21:15:04 | INFO     | _sample_json_file    | SAMPLED[JSON]: project-23-at-2025-12-07-19-40-cc032f45.json (60 items)
2025-12-14 21:15:04 | INFO     | _sample_json_file    | SAMPLED[JSON - copied intact]: project-10-at-2025-11-30-04-39-7cb5be60.json (7 items)
2025-12-14 21:15:04 | INFO     | _sample_json_file    | SAMPLED[JSON]: project-26-at-2025-12-06-20-54-7dd50846.json (60 items)
2025-12-14 21:15:04 | INFO     | _sample_json_file    | SAMPLED[JSON]: project-26-at-2025-12-06-20-53-7dd50846.json (60 items)
2025-12-14 21:15:04 | INFO     | _sample_json_file    | SAMPLED[JSON - copied intact]: project-29-at-2025-12-06-18-02-925495c2.json (3 items)
2025-12-14 21:15:04 | INFO     | _sample_json_file    | SAMPLED[JSON]: project-21-at-2025-12-07-13-35-9f9dfd99.json (60 items)
2025-12-14 21:15:04 | INFO     | _sample_json_file    | SAMPLED[JSON]: project-24-at-2025-12-08-04-19-de07973b.json (60 items)
2025-12-14 21:15:04 | INFO     | _sample_json_file    | SAMPLED[JSON]: project-15-at-2025-12-08-00-33-d7c44bd6.json (60 items)
2025-12-14 21:15:04 | INFO     | _sample_json_file    | SAMPLED[JSON]: project-14-at-2025-12-07-21-56-998754c4.json (60 items)
2025-12-14 21:15:04 | INFO     | _sample_json_file    | SAMPLED[JSON]: project-13-at-2025-12-07-21-59-b32f81aa.json (60 items)
2025-12-14 21:15:04 | INFO     | _sample_json_file    | SAMPLED[JSON]: project-17-at-2025-12-07-19-41-54b48278.json (60 items)
2025-12-14 21:15:04 | INFO     | _sample_json_file    | SAMPLED[JSON]: project-25-at-2025-12-06-19-04-abc3c31f.json (60 items)
2025-12-14 21:15:04 | INFO     | _sample_json_file    | SAMPLED[JSON]: project-26-at-2025-12-06-17-55-f4ae717b.json (60 items)
2025-12-14 21:15:04 | INFO     | _sample_json_file    | SAMPLED[JSON]: project-26-at-2025-12-07-13-35-7dd50846.json (60 items)
2025-12-14 21:15:04 | INFO     | _sample_json_file    | SAMPLED[JSON - copied intact]: project-10-at-2025-11-30-04-35-1b7cb632.json (3 items)
2025-12-14 21:15:04 | INFO     | _sample_json_file    | SAMPLED[JSON]: project-15-at-2025-12-06-19-14-131ccc11.json (60 items)
2025-12-14 21:15:04 | INFO     | _sample_json_file    | SAMPLED[JSON]: project-28-at-2025-11-30-17-52-c4bb3d81.json (60 items)
2025-12-14 21:15:04 | INFO     | _sample_csv_file     | SAMPLED[CSV]: 68ec1df6-examples_passive_aggression-GOLD-AI_unlabeled.csv (61 rows)
2025-12-14 21:15:04 | INFO     | _sample_csv_file     | SAMPLED[CSV]: d9a8cc22-examples_passive_aggression-GOLD-AI_unlabeled.csv (61 rows)
2025-12-14 21:15:04 | INFO     | _sample_csv_file     | SAMPLED[CSV]: dcfd25cc-examples_mixed_signals-GOLD-AI_unlabeled.csv (61 rows)
2025-12-14 21:15:04 | INFO     | _sample_csv_file     | SAMPLED[CSV]: af60b9e4-examples_mixed_signals-GOLD-AI_unlabeled.csv (61 rows)
2025-12-14 21:15:04 | INFO     | _sample_csv_file     | SAMPLED[CSV]: a9ed1150-examples_strategic_politeness-GOLD-AI_unlabeled.csv (61 rows)
2025-12-14 21:15:04 | INFO     | _sample_csv_file     | SAMPLED[CSV]: cd126592-examples_strategic_politeness-GOLD-AI_unlabeled.csv (61 rows)
2025-12-14 21:15:04 | INFO     | _sample_csv_file     | SAMPLED[CSV]: 0c74ef73-examples_strategic_politeness-GOLD-AI_unlabeled.csv (61 rows)
2025-12-14 21:15:04 | INFO     | _sample_csv_file     | SAMPLED[CSV]: 63afa046-examples_deflection_misdirection-GOLD-AI_unlabeled.csv (61 rows)
2025-12-14 21:15:04 | INFO     | _sample_csv_file     | SAMPLED[CSV]: 6245b265-examples_strategic_politeness-GOLD-AI_unlabeled.csv (61 rows)
2025-12-14 21:15:04 | INFO     | _sample_csv_file     | SAMPLED[CSV]: 683d1d60-examples_mixed_signals-GOLD-AI_unlabeled.csv (61 rows)
2025-12-14 21:15:04 | INFO     | _sample_csv_file     | SAMPLED[CSV]: 2bcc3bb4-examples_mixed_signals-GOLD-AI_unlabeled.csv (61 rows)
2025-12-14 21:15:04 | INFO     | _sample_csv_file     | SAMPLED[CSV]: 36ddaf65-examples_passive_aggression-GOLD-AI_unlabeled.csv (61 rows)
2025-12-14 21:15:04 | INFO     | _sample_csv_file     | SAMPLED[CSV]: bc1f704c-examples_passive_aggression-GOLD-AI_unlabeled.csv (61 rows)
2025-12-14 21:15:04 | INFO     | _sample_csv_file     | SAMPLED[CSV]: b94a97f5-examples_passive_aggression-GOLD-AI_unlabeled.csv (61 rows)
2025-12-14 21:15:04 | INFO     | _sample_csv_file     | SAMPLED[CSV]: 9d1953bd-examples_passive_aggression-GOLD-AI_unlabeled.csv (61 rows)
2025-12-14 21:15:04 | INFO     | _sample_csv_file     | SAMPLED[CSV]: e5f59c69-examples_mixed_signals-GOLD-AI_unlabeled.csv (61 rows)
2025-12-14 21:15:04 | INFO     | _sample_csv_file     | SAMPLED[CSV]: 44656162-examples_mixed_signals-GOLD-AI_unlabeled.csv (61 rows)
2025-12-14 21:15:04 | INFO     | _sample_csv_file     | SAMPLED[CSV]: 87760998-examples_strategic_politeness-GOLD-AI_unlabeled.csv (61 rows)
2025-12-14 21:15:04 | INFO     | _sample_csv_file     | SAMPLED[CSV]: 10dc9035-examples_strategic_politeness-GOLD-AI_unlabeled.csv (61 rows)
2025-12-14 21:15:04 | INFO     | _sample_csv_file     | SAMPLED[CSV]: 80e6df16-examples_passive_aggression-GOLD-AI_unlabeled.csv (61 rows)
2025-12-14 21:15:04 | INFO     | _sample_csv_file     | SAMPLED[CSV]: 4b1b130e-examples_passive_aggression-GOLD-AI_unlabeled.csv (61 rows)
2025-12-14 21:15:04 | INFO     | _sample_csv_file     | SAMPLED[CSV]: e706c64c-examples_sarcasm_irony-GOLD-AI_unlabeled.csv (61 rows)
2025-12-14 21:15:04 | INFO     | _sample_csv_file     | SAMPLED[CSV]: 012a3cd5-examples_sarcasm_irony-GOLD-AI_unlabeled.csv (61 rows)
2025-12-14 21:15:04 | INFO     | _sample_csv_file     | SAMPLED[CSV]: 8e85f060-examples_sarcasm_irony-GOLD-AI_unlabeled.csv (61 rows)
2025-12-14 21:15:04 | INFO     | _sample_csv_file     | SAMPLED[CSV]: 193bddc7-examples_sarcasm_irony-GOLD-AI_unlabeled.csv (61 rows)
2025-12-14 21:15:04 | INFO     | _sample_csv_file     | SAMPLED[CSV]: a8ab4518-examples_sarcasm_irony-GOLD-AI_unlabeled.csv (61 rows)
2025-12-14 21:15:04 | INFO     | _sample_csv_file     | SAMPLED[CSV]: 29da267f-examples_sarcasm_irony-GOLD-AI_unlabeled.csv (61 rows)
2025-12-14 21:15:04 | INFO     | _sample_csv_file     | SAMPLED[CSV]: addf87c0-examples_deflection_misdirection-GOLD-AI_unlabeled.csv (61 rows)
2025-12-14 21:15:04 | INFO     | _sample_csv_file     | SAMPLED[CSV]: 8116c184-examples_deflection_misdirection-GOLD-AI_unlabeled.csv (61 rows)
2025-12-14 21:15:04 | INFO     | _sample_csv_file     | SAMPLED[CSV]: 1700296b-examples_deflection_misdirection-GOLD-AI_unlabeled.csv (61 rows)
2025-12-14 21:15:04 | INFO     | _sample_csv_file     | SAMPLED[CSV]: bf0595da-examples_deflection_misdirection-GOLD-AI_unlabeled.csv (61 rows)
2025-12-14 21:15:04 | INFO     | _sample_csv_file     | SAMPLED[CSV]: f345bdd8-examples_deflection_misdirection-GOLD-AI_unlabeled.csv (61 rows)
2025-12-14 21:15:04 | INFO     | _sample_csv_file     | SAMPLED[CSV]: 18fbc234-examples_deflection_misdirection-GOLD-AI_unlabeled.csv (61 rows)
2025-12-14 21:15:04 | INFO     | _sample_csv_file     | SAMPLED[CSV]: 2e50dc7e-examples_deflection_misdirection-GOLD-AI_unlabeled.csv (61 rows)
2025-12-14 21:15:04 | INFO     | _sample_csv_file     | SAMPLED[CSV]: f8c0a675-examples_deflection_misdirection-GOLD-AI_unlabeled.csv (61 rows)
2025-12-14 21:15:04 | INFO     | _sample_csv_file     | SAMPLED[CSV]: 03f06274-examples_sarcasm_irony-GOLD-AI_unlabeled.csv (61 rows)
2025-12-14 21:15:04 | INFO     | _sample_csv_file     | SAMPLED[CSV]: 88901e33-examples_sarcasm_irony-GOLD-AI_unlabeled.csv (61 rows)
2025-12-14 21:15:04 | INFO     | _sample_csv_file     | SAMPLED[CSV]: 44fcf5d3-examples_strategic_politeness-GOLD-AI_unlabeled.csv (61 rows)
2025-12-14 21:15:04 | INFO     | _sample_csv_file     | SAMPLED[CSV]: 742645f0-examples_strategic_politeness-GOLD-AI_unlabeled.csv (61 rows)
2025-12-14 21:15:04 | INFO     | _sample_json_file    | SAMPLED[JSON]: examples_mixed_signals_min.json (60 items)
2025-12-14 21:15:04 | INFO     | _sample_json_file    | SAMPLED[JSON]: examples_strategic_politeness_min.json (60 items)
2025-12-14 21:15:04 | INFO     | _sample_json_file    | SAMPLED[JSON]: examples_deflection_misdirection_min.json (60 items)
2025-12-14 21:15:04 | INFO     | _sample_json_file    | SAMPLED[JSON]: examples_passive_aggression_min.json (60 items)
2025-12-14 21:15:04 | INFO     | _sample_json_file    | SAMPLED[JSON]: examples_sarcasm_irony_min.json (60 items)
2025-12-14 21:15:06 | INFO     | _sample_csv_file     | SAMPLED[CSV]: umath-validation-set-log2.csv (1629 rows)
2025-12-14 21:15:06 | INFO     | _sample_csv_file     | SAMPLED[CSV]: umath-validation-set-arcsinh.csv (1429 rows)
2025-12-14 21:15:06 | INFO     | _sample_csv_file     | SAMPLED[CSV]: umath-validation-set-arctanh.csv (1429 rows)
2025-12-14 21:15:06 | INFO     | _sample_csv_file     | SAMPLED[CSV]: umath-validation-set-sin.csv (1370 rows)
2025-12-14 21:15:06 | INFO     | _sample_csv_file     | SAMPLED[CSV]: umath-validation-set-cos.csv (1375 rows)
2025-12-14 21:15:06 | INFO     | _sample_csv_file     | SAMPLED[CSV]: umath-validation-set-cbrt.csv (1429 rows)
2025-12-14 21:15:06 | INFO     | _sample_csv_file     | SAMPLED[CSV]: umath-validation-set-arctan.csv (1429 rows)
2025-12-14 21:15:06 | INFO     | _sample_csv_file     | SAMPLED[CSV]: umath-validation-set-cosh.csv (1429 rows)
2025-12-14 21:15:06 | INFO     | _sample_csv_file     | SAMPLED[CSV]: umath-validation-set-expm1.csv (1429 rows)
2025-12-14 21:15:06 | INFO     | _sample_csv_file     | SAMPLED[CSV]: umath-validation-set-sinh.csv (1429 rows)
2025-12-14 21:15:06 | INFO     | _sample_csv_file     | SAMPLED[CSV]: umath-validation-set-tanh.csv (1429 rows)
2025-12-14 21:15:06 | INFO     | _sample_csv_file     | SAMPLED[CSV]: umath-validation-set-log10.csv (1629 rows)
2025-12-14 21:15:06 | INFO     | _sample_csv_file     | SAMPLED[CSV]: umath-validation-set-arcsin.csv (1429 rows)
2025-12-14 21:15:06 | INFO     | _sample_csv_file     | SAMPLED[CSV]: umath-validation-set-arccos.csv (1429 rows)
2025-12-14 21:15:06 | INFO     | _sample_csv_file     | SAMPLED[CSV]: umath-validation-set-log1p.csv (1429 rows)
2025-12-14 21:15:06 | INFO     | _sample_csv_file     | SAMPLED[CSV]: umath-validation-set-log.csv (271 rows)
2025-12-14 21:15:06 | INFO     | _sample_csv_file     | SAMPLED[CSV]: umath-validation-set-exp2.csv (1429 rows)
2025-12-14 21:15:06 | INFO     | _sample_csv_file     | SAMPLED[CSV]: umath-validation-set-arccosh.csv (1429 rows)
2025-12-14 21:15:06 | INFO     | _sample_csv_file     | SAMPLED[CSV]: umath-validation-set-tan.csv (1429 rows)
2025-12-14 21:15:06 | INFO     | _sample_csv_file     | SAMPLED[CSV]: umath-validation-set-exp.csv (412 rows)
2025-12-14 21:15:07 | INFO     | _sample_csv_file     | SAMPLED[CSV]: philox-testset-1.csv (1001 rows)
2025-12-14 21:15:07 | INFO     | _sample_csv_file     | SAMPLED[CSV]: philox-testset-2.csv (1001 rows)
2025-12-14 21:15:07 | INFO     | _sample_csv_file     | SAMPLED[CSV]: sfc64-testset-1.csv (1001 rows)
2025-12-14 21:15:07 | INFO     | _sample_csv_file     | SAMPLED[CSV]: sfc64-testset-2.csv (1001 rows)
2025-12-14 21:15:07 | INFO     | _sample_csv_file     | SAMPLED[CSV]: mt19937-testset-2.csv (1001 rows)
2025-12-14 21:15:07 | INFO     | _sample_csv_file     | SAMPLED[CSV]: mt19937-testset-1.csv (1001 rows)
2025-12-14 21:15:07 | INFO     | _sample_csv_file     | SAMPLED[CSV]: pcg64-testset-1.csv (1001 rows)
2025-12-14 21:15:07 | INFO     | _sample_csv_file     | SAMPLED[CSV]: pcg64-testset-2.csv (1001 rows)
2025-12-14 21:15:07 | INFO     | _sample_csv_file     | SAMPLED[CSV]: pcg64dxsm-testset-1.csv (1001 rows)
2025-12-14 21:15:07 | INFO     | _sample_csv_file     | SAMPLED[CSV]: pcg64dxsm-testset-2.csv (1001 rows)
2025-12-14 21:15:07 | INFO     | _sample_csv_file     | SAMPLED[CSV]: msft.csv (66 rows)
2025-12-14 21:15:07 | INFO     | _sample_csv_file     | SAMPLED[CSV]: data_x_x2_x3.csv (11 rows)
2025-12-14 21:15:07 | INFO     | _sample_csv_file     | SAMPLED[CSV]: Stocks.csv (526 rows)
2025-12-14 21:15:09 | INFO     | _sample_json_file    | SAMPLED[JSON - copied intact]: project-5-at-2025-11-30-04-52-62abf398.json (4 items)
2025-12-14 21:15:09 | INFO     | _sample_json_file    | SAMPLED[JSON - copied intact]: project-5-at-2025-11-30-04-51-7f97e080.json (1 items)
2025-12-14 21:15:09 | INFO     | _sample_json_file    | SAMPLED[JSON - copied intact]: project-10-at-2025-11-30-04-39-7cb5be60.json (7 items)
2025-12-14 21:15:09 | INFO     | _sample_json_file    | SAMPLED[JSON - copied intact]: project-10-at-2025-11-30-04-35-1b7cb632.json (3 items)
2025-12-14 21:15:09 | INFO     | _sample_json_file    | SAMPLED[JSON]: project-28-at-2025-11-30-17-52-c4bb3d81.json (60 items)
2025-12-14 21:15:09 | INFO     | _sample_csv_file     | SAMPLED[CSV]: cb5638af-examples_passive_aggression-GOLD-AI_unlabeled.csv (61 rows)
2025-12-14 21:15:09 | INFO     | _sample_csv_file     | SAMPLED[CSV]: 4b772a9e-examples_mixed_signals-GOLD-AI_unlabeled.csv (61 rows)
2025-12-14 21:15:09 | INFO     | _sample_csv_file     | SAMPLED[CSV]: 9f461143-examples_strategic_politeness-GOLD-AI_unlabeled.csv (61 rows)
2025-12-14 21:15:09 | INFO     | _sample_csv_file     | SAMPLED[CSV]: 5e21e7d9-examples_sarcasm_irony-GOLD-AI_unlabeled.csv (61 rows)
2025-12-14 21:15:09 | INFO     | _sample_csv_file     | SAMPLED[CSV]: 0aafbe8a-examples_strategic_politeness-GOLD-AI_unlabeled.csv (61 rows)
2025-12-14 21:15:09 | INFO     | _sample_csv_file     | SAMPLED[CSV]: f0a68712-examples_mixed_signals-GOLD-AI_unlabeled.csv (61 rows)
2025-12-14 21:15:09 | INFO     | _sample_csv_file     | SAMPLED[CSV]: e87b04f3-examples_deflection_misdirection-GOLD-AI_unlabeled.csv (61 rows)
2025-12-14 21:15:09 | INFO     | _sample_csv_file     | SAMPLED[CSV]: b8b87912-examples_passive_aggression-GOLD-AI_unlabeled.csv (61 rows)
2025-12-14 21:15:09 | INFO     | _sample_csv_file     | SAMPLED[CSV]: 817e0d36-examples_mixed_signals-GOLD-AI_unlabeled.csv (61 rows)
2025-12-14 21:15:09 | INFO     | _sample_csv_file     | SAMPLED[CSV]: bc682ff7-examples_passive_aggression-GOLD-AI_unlabeled.csv (61 rows)
2025-12-14 21:15:09 | INFO     | _sample_csv_file     | SAMPLED[CSV]: 4401cc60-examples_strategic_politeness-GOLD-AI_unlabeled.csv (61 rows)
2025-12-14 21:15:09 | INFO     | _sample_csv_file     | SAMPLED[CSV]: 290ffa53-examples_passive_aggression-GOLD-AI_unlabeled.csv (61 rows)
2025-12-14 21:15:09 | INFO     | _sample_csv_file     | SAMPLED[CSV]: 5775fd1d-examples_strategic_politeness-GOLD-AI_unlabeled.csv (61 rows)
2025-12-14 21:15:09 | INFO     | _sample_csv_file     | SAMPLED[CSV]: c71bfa31-examples_mixed_signals-GOLD-AI_unlabeled.csv (61 rows)
2025-12-14 21:15:09 | INFO     | _sample_csv_file     | SAMPLED[CSV]: 88653146-examples_passive_aggression-GOLD-AI_unlabeled.csv (61 rows)
2025-12-14 21:15:09 | INFO     | _sample_csv_file     | SAMPLED[CSV]: 5ce6e35f-examples_sarcasm_irony-GOLD-AI_unlabeled.csv (61 rows)
2025-12-14 21:15:09 | INFO     | _sample_csv_file     | SAMPLED[CSV]: ebbbd8f5-examples_sarcasm_irony-GOLD-AI_unlabeled.csv (61 rows)
2025-12-14 21:15:09 | INFO     | _sample_csv_file     | SAMPLED[CSV]: 63acc8b7-IMDB_train_unlabeled_100.csv (99 rows)
2025-12-14 21:15:09 | INFO     | _sample_csv_file     | SAMPLED[CSV]: 2c88d56e-examples_deflection_misdirection-GOLD-AI_unlabeled.csv (61 rows)
2025-12-14 21:15:09 | INFO     | _sample_csv_file     | SAMPLED[CSV]: 747b9d69-examples_sarcasm_irony-GOLD-AI_unlabeled.csv (61 rows)
2025-12-14 21:15:09 | INFO     | _sample_csv_file     | SAMPLED[CSV]: a3b04cb0-examples_deflection_misdirection-GOLD-AI_unlabeled.csv (61 rows)
2025-12-14 21:15:09 | INFO     | _sample_csv_file     | SAMPLED[CSV]: 566b3478-IMDB_train_unlabeled_100.csv (99 rows)
2025-12-14 21:15:09 | INFO     | _sample_csv_file     | SAMPLED[CSV]: 551cd9e6-examples_deflection_misdirection-GOLD-AI_unlabeled.csv (61 rows)
2025-12-14 21:15:09 | INFO     | _sample_csv_file     | SAMPLED[CSV]: eb7f33cc-examples_sarcasm_irony-GOLD-AI_unlabeled.csv (61 rows)
2025-12-14 21:15:09 | INFO     | _sample_csv_file     | SAMPLED[CSV]: 54beab11-examples_strategic_politeness-GOLD-AI_unlabeled.csv (61 rows)
2025-12-14 21:15:09 | INFO     | _print_summary       | 
======================================================================
2025-12-14 21:15:09 | INFO     | _print_summary       | DISTILLATION SUMMARY
2025-12-14 21:15:09 | INFO     | _print_summary       | ======================================================================
2025-12-14 21:15:09 | INFO     | _print_summary       | Total files scanned:  16093
2025-12-14 21:15:09 | INFO     | _print_summary       | Files copied:         58
2025-12-14 21:15:09 | INFO     | _print_summary       | Files sampled:        958
2025-12-14 21:15:09 | INFO     | _print_summary       | Files skipped:        13606
2025-12-14 21:15:09 | INFO     | _print_summary       | Errors:               0
2025-12-14 21:15:09 | INFO     | _print_summary       | 
Skip reasons breakdown:
2025-12-14 21:15:09 | INFO     | _print_summary       |   not_whitelisted               :  11012
2025-12-14 21:15:09 | INFO     | _print_summary       |   blacklist_ext:.pyc            :   2102
2025-12-14 21:15:09 | INFO     | _print_summary       |   blacklist_ext:.so             :    208
2025-12-14 21:15:09 | INFO     | _print_summary       |   blacklist_ext:.md             :    103
2025-12-14 21:15:09 | INFO     | _print_summary       |   blacklist_pattern:_v\d{1,2}\.py$:     32
2025-12-14 21:15:09 | INFO     | _print_summary       |   blacklist_ext:.log            :     31
2025-12-14 21:15:09 | INFO     | _print_summary       |   blacklist_ext:.png            :     30
2025-12-14 21:15:09 | INFO     | _print_summary       |   blacklist_ext:.wav            :     22
2025-12-14 21:15:09 | INFO     | _print_summary       |   blacklist_ext:.svg            :     19
2025-12-14 21:15:09 | INFO     | _print_summary       |   blacklist_ext:.pdf            :     16
2025-12-14 21:15:09 | INFO     | _print_summary       |   file_size>5MB                 :      7
2025-12-14 21:15:09 | INFO     | _print_summary       |   blacklist_pattern:^step\d{1,2}:      5
2025-12-14 21:15:09 | INFO     | _print_summary       |   blacklist_ext:.gz             :      5
2025-12-14 21:15:09 | INFO     | _print_summary       |   blacklist_pattern:\.bak$      :      4
2025-12-14 21:15:09 | INFO     | _print_summary       |   blacklist_pattern:^utils_     :      2
2025-12-14 21:15:09 | INFO     | _print_summary       |   blacklist_ext:.a              :      2
2025-12-14 21:15:09 | INFO     | _print_summary       |   blacklist_ext:.zip            :      1
2025-12-14 21:15:09 | INFO     | _print_summary       |   blacklist_file                :      1
2025-12-14 21:15:09 | INFO     | _print_summary       |   blacklist_ext:.jpg            :      1
2025-12-14 21:15:09 | INFO     | _print_summary       | ======================================================================

2025-12-14 21:15:09 | INFO     | main                 | ✓ Distillation completed successfully
